card_id,title,price_primary,price_history,location,labels,description,vehicle_history,comment,scrap_date,source_id,dl_loaded_date
YU433985,2023 Hyundai Elantra N Line,"$27,500","4/11/23: $28,500 | 4/19/23: $28,000 | 4/28/23: $27,500","2405 N Interstate 35 Round Rock, TX 78665",Home Delivery|Virtual Appointments|VIN: KMHLR4AF3PU433985,"2023, Automatic, 1.6L I4 16V GDI DOHC Turbo, Gasoline, 156 mi. | sedan, Front-wheel Drive, Metal",Accidents or damage: None reported | 1-owner vehicle: No | Personal use only: No,"Certified.https://www.kbb.com/kbbreport/lups3 Clean CARFAX. Elantra N Line, 4D Sedan, I4, 7-Speed Dual Clutch DCT, FWD, Fluid Metal, Black Cloth.Option Group 01, Preferred Accessory Package (Cargo Side Bins, First Aid Kit, and Trunk/Cargo Hook), Elantra N Line, 4D Sedan, I4, 7-Speed Dual Clutch DCT,|…|FWD, Fluid Metal, Black Cloth, 18 x 7.5J Alloy Wheels, 4-Wheel Disc Brakes, 6 Speakers, ABS brakes, Air Conditioning, Alloy wheels, AM/FM radio: SiriusXM, Apple CarPlay & Android Auto, Auto High-beam Headlights, Automatic temperature control, Brake assist, Bumpers: body-color, Cargo Net, Carpeted Floor Mats, Combination Cloth & Leather Seating Surfaces, Delay-off headlights, Driver door bin, Driver vanity mirror, Dual front impact airbags, Dual front side impact airbags, Electronic Stability Control, Emergency communication system: Blue Link Connected Car Service (3-year complimentary subscription), Exterior Parking Camera Rear, Four wheel independent suspension, Front anti-roll bar, Front Bucket Seats, Front Center Armrest, Front dual zone A/C, Front reading lights, Fully automatic headlights, Heated door mirrors, Heated front seats, Heated Front Sport Bucket Seats, Illuminated entry, Leather Shift Knob, Leather steering wheel, Low tire pressure warning, Navigation System, Occupant sensing airbag, Outside temperature display, Overhead airbag, Panic alarm, Passenger door bin, Passenger vanity mirror, Power door mirrors, Power driver seat, Power moonroof, Power steering, Power windows, Radio: AM/FM/HD/SiriusXM Display Audio, Rear anti-roll bar, Rear seat center armrest, Rear window defroster, Remote keyless entry, Security system, Speed control, Speed-sensing steering, Split folding rear seat, Spoiler, Sport steering wheel, Steering wheel mounted audio controls, Tachometer, Telescoping steering wheel, Tilt steering wheel, Traction control, Trip computer, and Variably intermittent wipers.Please visit us at Round Rock Hyundai to experience the difference that only happens w",2023-05-01T08:03:23.000Z,cars.com scrapper,2023-05-03T22:26:45.376Z
J10645A,2023 Acura Integra A-Spec,"$28,995","3/17/23: $31,495 | 3/25/23: $30,995 | 4/04/23: $30,495 | 4/11/23: $29,995 | 4/18/23: $29,895 | 4/25/23: $29,495 | 4/27/23: $29,316 | 4/28/23: $28,995","1155 W Dundee Rd Arlington Heights, IL 60004","Great Deal | $5,467 under|Home Delivery|Virtual Appointments|VIN: 19UDE4H34PA007712","2023, Automatic CVT, 1.5L I4 16V GDI DOHC Turbo, Gasoline (29–36 mpg), 5 689 mi. | hatchback, Front-wheel Drive, Platinum White Pearl",Accidents or damage: None reported | 1-owner vehicle: Yes | Personal use only: Yes,"Great looking well maintained Loaded 2023 Acura Integra A-Spec Package 1.5L automatic 4-door sport sedan. Factory Warranty. 18 Alloy Wheels, Collision Mitigation System, Blind Spot System, Apple CarPlay/Android Auto, Fog Lights, Heated Seats, Lane departure: Lane Keeping Assist System, Power driver|…|seat, Power Moonroof, 8-Speaker Premium Audio System, Platinum White Pearl paint upgrade, Security system, Traction control and more. Financing Available. WE WANT YOUR TRADE-IN! Drive off the lot with complete peace of mind, knowing that this Acura Integra A-Spec is covered by the CARFAX Buyback Guarantee. At Napleton's Arlington Heights Jeep we strive to provide you with the best quality vehicles for the lowest prices, and this Acura Integra A-Spec is no exception. Independent Inspections are Welcome.",2023-05-01T08:06:13.000Z,cars.com scrapper,2023-05-03T22:26:45.376Z
P2699,2023 Kia Rio S,"$19,211","3/31/23: $19,687 | 4/08/23: $19,487 | 4/18/23: $19,211","2054 US-441 Dublin, GA 31021",Home Delivery|Virtual Appointments|VIN: 3KPA24AD1PE520488,"2023, Automatic CVT, 1.6L I4 16V MPFI DOHC, Gasoline, 16 689 mi. | sedan, Front-wheel Drive, Silky Silver",Accidents or damage: None reported | Clean title: Yes | 1-owner vehicle: Yes | Personal use only: Yes,"The Jimmy Britt Premium Delivery Program lets you buy this vehicle right from the comfort of your couch. We frequently deliver vehicles nationwide, and even arrange test drives at home, if youre nearby. Well send you a personal video on any vehicle you are interested in. Call, email, or text us for|…|details. (Plus, you get our low-price guarantee and 2 free oil changes!) Priced below KBB Fair Purchase Price! 32/41 City/Highway MPG Clean History Report, Backup Camera, 1 Owner, Extended Warranty Available, Hands-Free/Bluetooth, Multi-function Steering Wheel, Includes the Remainder of the Factory Warranty, Apple Carplay, Android Auto, Security Alarm, Premium Delivery Service Available, Rio S, 4D Sedan, Silky Silver, Black w/Woven Cloth Seat Trim, 15 Alloy Wheels, 6 Speakers, Automatic Temperature Control, Brake assist, Chrome Door Handles, Forward Collision Avoidance Assist, Fully automatic headlights, Highline Tire Pressure Monitoring System (TPMS), Illuminated entry, LED Headlights, LED Positioning Lights, Low tire pressure warning, Push Button Start w/Immobilizer, Radio: AM/FM/MP3/SiriusXM Audio System, Rear Disc Brakes, Rear Occupant Alert, Remote keyless entry, Steering wheel mounted audio controls, Supervision Meter Cluster, Technology Package, Tilt steering wheel. Silky Silver 2023 Kia Rio S FWD The Jimmy Britt Automotive Family has received multiple Dealer of the Year awards in the state of Georgia. We've also been awarded the Customer Satisfaction Award through DealerRater! Price does not include State/County/Local Tax, Tag, GA Lemon Law or Registration fees. Dealer administrative fee is included in the price. We offer electronic tag and title as an option for an additional fee (this fee is based on what your state/county charge to participate as well as a fee to the company we select to process). A fee may be charged to customers wishing to have the vehicle delivered. New Vehicles - Must finance with Chrysler Capital to receive all rebates and ince",2023-05-01T08:00:53.000Z,cars.com scrapper,2023-05-03T22:26:45.376Z
YP1943,2023 Hyundai Sonata SEL,"$23,997","4/12/23: $25,490 | 4/27/23: $23,997","1950 Tamiami Trail Punta Gorda, FL 33950",Fair Deal|Home Delivery|Virtual Appointments|VIN: KMHL64JA3PA257373,"2023, Automatic, Regular Unleaded I-4 2.5 L/152, Gasoline (27–37 mpg), 8 879 mi. | sedan, Front-wheel Drive, Onyx Black",Accidents or damage: None reported | Clean title: Yes | Personal use only: Yes,"This Hyundai Sonata is Certified Preowned! Value priced below the market average! This 2023 Hyundai Sonata SEL, has a great Onyx Black exterior, and a clean Dark Gray interior! -Only 8,879 miles which is low for a 2023 ! This model has many valuable options -Navigation -Backup Camera -Bluetooth -Sat|…|ellite Radio -Aux. Audio Input -Heated Front Seats -Heated Mirrors -Auto Climate Control -High Intensity Headlights -Automatic Headlights -Front Wheel Drive -Multi-Zone Air Conditioning -Remote Start -Security System -Power Locks -Keyless Entry -Power Windows -Steering Wheel Controls -Cruise Control Automatic Transmission -Rear Bench Seats -Alloy Wheels -Tire Pressure Monitors On top of that, it has many safety features -Brake Assist -Traction Control -Stability Control Save money at the pump, knowing this Hyundai Sonata gets 37.0/27.0 MPG! Call to confirm availability and schedule a no-obligation test drive!  We are located at 1950 Tamiami Trail, Punta Gorda, FL 33950. Prices are PLUS tax, tag, title fee, $1,099 Pre-Delivery Service Charge and $385 Electronic Tag Registration Filing Fee and dealer installed options and $1,495 average investment in vehicle reconditioning charge (see dealer for details). Customer must trade-in a vehicle to receive $1,000 Trade Assist credit. Financing must be provided by a third-party lender using this dealerships assistance for Customer to receive $1,000 Financing Assist credit. See dealer for complete details. A copy of the advertisement must be presented at time of purchase to receive any special or advertised price. Prior sales are excluded. We attempt to update this inventory regularly; however, there can be lag time between the sale of a vehicle and the updating of inventory. Vehicle information is based off standard equipment and may vary from vehicle to vehicle. Call or email for complete vehicle information. All specifications, prices and equipment are subject to change without notice.  Fees/charges represents costs and profit to the dealer for items such as inspecting, cleaning, and adjusting vehicles, and preparing documents related to the sale.",2023-05-01T08:06:04.000Z,cars.com scrapper,2023-05-03T22:26:45.376Z
BZF136,2023 Subaru Impreza Base,"$23,750","2/17/23: $27,000 | 2/24/23: $25,000 | 2/26/23: $24,500 | 2/28/23: $24,250 | 3/04/23: $25,500 | 3/14/23: $25,250 | 3/23/23: $25,000 | 4/01/23: $24,750 | 4/10/23: $24,500 | 4/15/23: $24,000 | 4/27/23: $23,750","9135 Winchester Rd Front Royal, VA 22630","Great Deal | $2,111 under|Home Delivery|Virtual Appointments|VIN: 4S3GTAB68P3705893","2023, Automatic CVT, 2.0L H4 16V GDI DOHC, Gasoline, 4 037 mi. | hatchback, All-wheel Drive, Crystal White Pearl",Accidents or damage: None reported | 1-owner vehicle: Yes | Personal use only: No,"Crystal White Pearl 2023 Subaru Impreza AWD CVT Lineartronic 2.0L DOHC CARFAX 1-OWNER, NO ACCIDENTS REPORTED to CARFAX, MANUFACTURER'S WARRANTY STILL ACTIVE, LOW MILES, BACKUP CAMERA, 4D Hatchback, 2.0L DOHC, CVT Lineartronic, AWD, Crystal White Pearl, crystal white pearl black C|…|loth, 4 Speakers, 4-Wheel Disc Brakes, ABS brakes, Air Conditioning, AM/FM radio, Anti-whiplash front head restraints, Brake assist, Bumpers: body-color, Cloth Upholstery, Driver door bin, Driver vanity mirror, Dual front impact airbags, Dual front side impact airbags, Electronic Stability Control, Emergency communication system, Exterior Parking Camera Rear, EyeSight System, Four wheel independent suspension, Front anti-roll bar, Front Bucket Seats, Front Center Armrest, Front reading lights, High Grade Combination Meter w/Color LCD Display, Illuminated entry, Knee airbag, Low tire pressure warning, Occupant sensing airbag, Outside temperature display, Overhead airbag, Overhead console, Overhead Console Shower Light, Panic alarm, Passenger door bin, Passenger vanity mirror, Power door mirrors, Power steering, Power windows, Radio data system, Radio: Subaru STARLINK 6.5 Multimedia System, Rear Seat Reminder, Rear window defroster, Rear window wiper, Remote keyless entry, Security system, Speed control, Speed-sensing steering, Split folding rear seat, Spoiler, Standard Model w/CVT, STARLINK/Apple CarPlay/Android Auto, Steering wheel mounted audio controls, Tachometer, Telescoping steering wheel, Tilt steering wheel, Tire Pressure Monitoring System, Traction control, Trip computer, Variably intermittent wipers, Wheels: 16 x 6.5 Black Finish J Steel. Odometer is 574 miles below market average! 28/36 City/Highway MPG",2023-05-01T08:04:19.000Z,cars.com scrapper,2023-05-03T22:26:45.376Z
230594A,2023 Toyota Corolla Hatchback SE,"$25,391","","278 River St Hackensack, NJ 07601",Good Deal|Virtual Appointments|VIN: JTND4MBE9P3191976,"2023, Automatic CVT, 2.0L I4 16V PDI DOHC, Gasoline, 2 770 mi. | hatchback, Front-wheel Drive, Wind Chill Pearl / Midnight Black Metallic",Accidents or damage: At least 1 accident or damage reported | 1-owner vehicle: Yes | Personal use only: Yes,Wind Chill Pearl/Midnight Black Metallic 2023 Toyota Corolla Hatchback SE FWD CVT 2.0L I4|32/41 City/Highway MPG,2023-05-01T08:06:44.000Z,cars.com scrapper,2023-05-03T22:26:45.376Z
A230535A,2023 Toyota Corolla Hatchback SE,"$24,995","","278 River St Hackensack, NJ 07601",Virtual Appointments|VIN: JTND4MBE9P3196286,"2023, Automatic CVT, 2.0L I4 16V PDI DOHC, Gasoline, 116 mi. | hatchback, Front-wheel Drive, Midnight Black Metallic",Accidents or damage: None reported | 1-owner vehicle: Yes | Personal use only: Yes,Midnight Black Metallic 2023 Toyota Corolla Hatchback SE FWD CVT 2.0L I4|Odometer is 2754 miles below market average! 32/41 City/Highway MPG,2023-05-01T08:06:41.000Z,cars.com scrapper,2023-05-03T22:26:45.376Z
22903,2023 Kia Sportage LX,"$27,500","3/15/23: $28,000 | 3/28/23: $27,000 | 4/20/23: $27,500","7301 State Ave Kansas City Kansas City, KS 66112",Good Deal | $226 under|Home Delivery|Virtual Appointments|VIN: KNDPUCAF1P7039303,"2023, 8-Speed Automatic, 2.5L I4 16V PDI DOHC, Gasoline, 30 783 mi. | suv, All-wheel Drive, Gravity Gray",Accidents or damage: None reported | 1-owner vehicle: Yes | Personal use only: No,"Call us at (913) 222-5300 to schedule your test drive on this Gravity Gray 2023 Kia Sportage LX. Clean CARFAX. CARFAX One-Owner. Sportage LX, AWD, Gravity Gray, Black Cloth, Apple CarPlay & Android Auto, Heated front seats. 23/28 City/Highway MPG Want to know more? Text us at (913) 215-5243 to chat|…|about this vehicle! Oakes Mitsubishi strives to bring you the lowest prices possible! With our laid-back, quick and pain-free sales process, our high standard of customer service and our many financing options, we know you will find Oakes Auto to be a welcome change from your past experiences. All of our vehicles are reconditioned at our state-of-the-art service center and undergo a multi-point inspection to confirm they meet our expectations for our customers. Vehicle price as shown includes $2,000 Trade Discount and $1,000 Finance Discount, Trade Discount only on 2013 or newer model year with less than 100k miles. Finance Discount (requires financing through Ally Auto Finance or Kia Motors Finance; not all buyers will qualify. Located in Kansas City: 7301 State Ave, Kansas City, KS 66112 (913) 222-5300.",2023-05-01T08:03:04.000Z,cars.com scrapper,2023-05-03T22:26:45.376Z
H30409,2023 Subaru Legacy Premium,"$28,759","2/26/23: $30,875 | 4/05/23: $28,756","21736 Auto World Circle Sterling, VA 20166","Great Deal | $1,677 under|Home Delivery|Virtual Appointments|VIN: 4S3BWAF6XP3012576","2023, Automatic CVT, 2.5L H4 16V GDI DOHC, Gasoline, 648 mi. | sedan, All-wheel Drive, Crystal White Pearl",Accidents or damage: None reported | 1-owner vehicle: Yes | Personal use only: No,"2023 Subaru Legacy Premium AWD 4-Wheel Disc Brakes, 6 Speakers, ABS brakes, Air Conditioning, Alloy wheels, All-Weather Floor Liners, AM/FM radio: SiriusXM, Anti-whiplash front head restraints, Auto High-beam Headlights, Automatic temperature control, Brake assist, Bumpers: body-color, Cargo Net, Cl|…|oth Upholstery, Driver door bin, Driver vanity mirror, Dual front impact airbags, Dual front side impact airbags, Electronic Stability Control, Emergency communication system: STARLINK Safety Plus (3-year free trial), Exterior Parking Camera Rear, Four wheel independent suspension, Front anti-roll bar, Front Bucket Seats, Front Center Armrest w/Storage, Front dual zone A/C, Front reading lights, Fully automatic headlights, Heated door mirrors, Heated Front Bucket Seats, Heated front seats, Illuminated entry, Knee airbag, Low tire pressure warning, Occupant sensing airbag, Outside temperature display, Overhead airbag, Overhead console, Panic alarm, Passenger door bin, Passenger vanity mirror, Power door mirrors, Power driver seat, Power steering, Power windows, Radio: Subaru STARLINK 11.6 Multimedia Plus Sys, Rear anti-roll bar, Rear seat center armrest, Rear Seatback Protector, Rear window defroster, Remote keyless entry, Security system, Speed control, Speed-sensing steering, Splash Guards, Split folding rear seat, Steering wheel mounted audio controls, Tachometer, Telescoping steering wheel, Tilt steering wheel, Traction control, Trip computer, Turn signal indicator mirrors, Variably intermittent wipers, Wheels: 17 x 7.5J Aluminum-Alloy Black. Call directly 571-599-2238 to make an appointment with Pre Owned Sale Manager, William James here at Stohlman Subaru of Sterling! Loudoun County's #1 Subaru Destination! Odometer is 3787 miles below market average! 27/35 City/Highway MPG Call directly 571-599-2230 to make an appointment with Pre Owned Sale Manager, Mike Cerqueira here at Stohlman Subaru of Sterling! Loudoun County's #1 Subaru Destination! .",2023-05-01T08:04:20.000Z,cars.com scrapper,2023-05-03T22:26:45.376Z
P223331,2023 Chevrolet Malibu LT,"$28,000","3/30/23: $32,000 | 4/07/23: $31,000 | 4/14/23: $29,991 | 4/22/23: $28,000","4930 University Dr Huntsville, AL 35816",Great Deal | $661 under|CPO Warrantied|Home Delivery|Virtual Appointments|VIN: 1G1ZD5ST9PF142427|Included warranty,"2023, Automatic CVT, 1.5L I4 16V GDI DOHC Turbo, Gasoline, 567 mi. | sedan, Front-wheel Drive, Dark Ash Metallic",Accidents or damage: At least 1 accident or damage reported | Clean title: Yes | 1-owner vehicle: Yes | Personal use only: Yes,"138 POINT CERTIFIED INSPECTION PASSED, ALL SERVICE RECORDS AVAILABLE, AUTOMATIC HEADLIGHTS, CLEAN CARFAX, HEATED FRONT SEATS, INCLUDES THE REMAINDER OF THE fACTORY WARRANTY, LOCAL TRADE IN, MULTI FUNCTION STEERING WHEEL, ONE OWNER, REAR BACK UP CAMERA, SPECIAL INTEREST RATES AVAILABLE, APPLE CARPLAY|…|/ ANDROID AUTO, Jet Black Cloth, 19 Aluminum Wheels, 4-Wheel Disc Brakes, 6-Speaker Audio System Feature, 6-Way Manual Front Passenger Seat Adjuster, 8-Way Power Driver Seat Adjuster, ABS brakes, Alloy wheels, Auto High-beam Headlights, Automatic temperature control, Brake assist, Bumpers: body-color, Compass, Delay-off headlights, Driver door bin, Driver vanity mirror, Dual front impact airbags, Dual front side impact airbags, Electronic Stability Control, Emergency communication system: OnStar and Chevrolet connected services capable, Exterior Parking Camera Rear, Four wheel independent suspension, Front anti-roll bar, Front Bucket Seats, Front Center Armrest w/Storage, Front dual zone A/C, Front reading lights, Fully automatic headlights, Heated door mirrors, Heated Driver & Front Passenger Seats, Heated front seats, Illuminated entry, Knee airbag, Low tire pressure warning, Occupant sensing airbag, Outside temperature display, Overhead airbag, Overhead console, Panic alarm, Passenger door bin, Passenger vanity mirror, Power door mirrors, Power Driver Lumbar Control Seat Adjuster, Power driver seat, Preferred Equipment Group 1LT, Premium audio system: Chevrolet Infotainment 3 Plus, Premium Cloth Seat Trim, Rear anti-roll bar, Rear reading lights, Rear seat center armrest, Rear side impact airbag, Remote keyless entry, Security system, SiriusXM Radio, Speed control, Split folding rear seat, Steering wheel mounted audio controls, Tachometer, Telescoping steering wheel, Tilt steering wheel, Traction control, Trip computer, Variably intermittent wipers, Wireless Apple CarPlay/Android Auto, Wireless Apple CarPlay/Wireless Android Auto. FWD CVT 1.5L DOHC Odometer is 2614 m",2023-05-01T08:04:50.000Z,cars.com scrapper,2023-05-03T22:26:45.376Z
60110A,2023 Chevrolet Trailblazer LS,"$28,945","2/18/23: $29,699 | 3/25/23: $29,500 | 4/20/23: $29,400 | 4/28/23: $28,945","1405 N Osage Blvd Nevada, MO 64772",Good Deal|Home Delivery|Virtual Appointments|VIN: KL79MNSL3PB026720,"2023, 9-Speed Automatic, 1.3L I3 12V GDI DOHC Turbo, Gasoline, 700 mi. | suv, All-wheel Drive, Summit White",Accidents or damage: None reported | 1-owner vehicle: Yes | Personal use only: Yes,"Available at Max Motors GM in Nevada. 1405 N Osage Blvd, Nevada, MO. 2023 Chevrolet TrailBlazer LS AWD 9-Speed Automatic Summit White 1.3L Ecotec Turbo DOHC SIDI w/VVT Odometer is 3848 miles below market average! LOW LOW MILES, VERY COMFORTABLE AND CONVIENENT, 4-Wheel Disc Brakes, 6-Speaker Audio Sy|…|stem Feature w/Amplifier, 7 Diagonal Color Touchscreen, ABS brakes, Auto High-beam Headlights, Brake assist, Bumpers: body-color, Cloth Seat Trim, Delay-off headlights, Driver Confidence & Cruise Package, Driver vanity mirror, Dual front impact airbags, Dual front side impact airbags, Electronic Cruise Control w/Set & Resume Speed, Emergency communication system: OnStar and Chevrolet connected services capable, Front anti-roll bar, Front reading lights, Front wheel independent suspension, Fully automatic headlights, Illuminated entry, Knee airbag, Lane Change Alert w/Side Blind Zone Alert, Low tire pressure warning, Occupant sensing airbag, Overhead airbag, Passenger vanity mirror, Preferred Equipment Group 1LS, Rear Cross Traffic Alert, Rear Park Assist, Rear side impact airbag, Ride & Handling Suspension, Security system, Steering wheel mounted audio controls, Traction control, Variably intermittent wipers, Wheels: 17 Silver-Painted Aluminum, Wireless Apple CarPlay/Wireless Android Auto. CARFAX One-Owner. 26/30 City/Highway MPG",2023-05-01T08:03:41.000Z,cars.com scrapper,2023-05-03T22:26:45.376Z
